{
  "model_id": "logistic_v1",
  "version": "1.0.0",
  "description": "Encrypted logistic regression for binary classification",
  "he_scheme": "CKKS",
  "encryption_parameters": {
    "poly_modulus_degree": 16384,
    "scale": 1073741824,
    "coeff_modulus_bits": [60, 30, 30, 60],
    "max_multiplicative_depth": 2
  },
  "inference": {
    "input_dimension": 8,
    "output_dimension": 1,
    "activation": "polynomial_sigmoid_v1"
  },
  "parameters": {
    "weights": [0.15, -0.08, 0.11, 0.07, -0.12, 0.09, 0.05, -0.04],
    "bias": -0.02
  },
  "activation_parameters": {
    "kind": "polynomial_sigmoid_v1",
    "coefficients": [0.5, 0.197, 0.0]
  },
  "constraints": {
    "max_batch_size": 16
  }
}